"","GENENAME","ENTREZID","ENSEMBL","DESCRIPTION","min_peps","min_prob","min_crap_expt","orf_name","status","pma_int"
"455","GET3","851458","YDL100C","Guanine nucleotide exchange factor for Gpa1p; amplifies G protein signaling; functions as a chaperone under ATP-depleted oxidative stress conditions; subunit of GET complex, involved in ATP dependent Golgi to ER trafficking and insertion of tail-anchored (TA) proteins into ER membrane under non-stress conditions; binds as dimer to transmembrane domain (TMD) cargo, shielding TMDs from aqueous solvent; protein abundance increases under DNA replication stress","1","80","11","YDL100C","Interaction Data Present","Not A PMA1 Interactor"
"480","GGA2","856508","YHR108W","Protein that regulates Arf1p, Arf2p to facilitate Golgi trafficking; binds phosphatidylinositol 4-phosphate, which plays a role in TGN localization; has homology to gamma-adaptin; GGA2 has a paralog, GGA1, that arose from the whole genome duplication","1","80","11","YHR108W","Interaction Data Present","Not A PMA1 Interactor"
"481","GNP1","852121","YDR508C","High-affinity glutamine permease; also transports Leu, Ser, Thr, Cys, Met and Asn; expression is fully dependent on Grr1p and modulated by the Ssy1p-Ptr3p-Ssy5p (SPS) sensor of extracellular amino acids; GNP1 has a paralog, AGP1, that arose from the whole genome duplication","1","80","11","YDR508C","Interaction Data Present","Not A PMA1 Interactor"
"500","GPA1","856394","YHR005C","Subunit of the G protein involved in pheromone response; GTP-binding alpha subunit of the heterotrimeric G protein; negatively regulates the mating pathway by sequestering G(beta)gamma and by triggering an adaptive response; activates Vps34p at the endosome; protein abundance increases in response to DNA replication stress","1","80","11","YHR005C","Interaction Data Present","Not A PMA1 Interactor"
"518","GPD1","851539","YDL022W","NAD-dependent glycerol-3-phosphate dehydrogenase; key enzyme of glycerol synthesis, essential for growth under osmotic stress; expression regulated by high-osmolarity glycerol response pathway; protein abundance increases in response to DNA replication stress; constitutively inactivated via phosphorylation by the protein kinases Ypk1p and Ypk2p, dephosphorylation increases catalytic activity; forms a heterodimer with Pnc1p to facilitate its peroxisomal import","1","80","11","YDL022W","Interaction Data Present","Not A PMA1 Interactor"
"528","GYP5","855827","YPL249C","GTPase-activating protein (GAP) for yeast Rab family members; involved in ER to Golgi trafficking; exhibits GAP activity toward Ypt1p that is stimulated by Gyl1p, also acts on Sec4p; interacts with Gyl1p, Rvs161p and Rvs167p; involved in recruiting Rvs167p to the bud tip during polarized growth; relocalizes from bud neck to cytoplasm upon DNA replication stress; GYP5 has a paralog, GYL1, that arose from the whole genome duplication","1","80","11","YPL249C","Interaction Data Present","Not A PMA1 Interactor"
"552","HIP1","853104","YGR191W","High-affinity histidine permease; also involved in the transport of manganese ions","1","80","11","YGR191W","Interaction Data Present","PMA1 Interactor"
"574","IDH2","854303","YOR136W","Subunit of mitochondrial NAD(+)-dependent isocitrate dehydrogenase; complex catalyzes the oxidation of isocitrate to alpha-ketoglutarate in the TCA cycle; phosphorylated","1","80","11","YOR136W","Interaction Data Present","Not A PMA1 Interactor"
"587","ILV1","856819","YER086W","Threonine deaminase, catalyzes first step in isoleucine biosynthesis; expression is under general amino acid control; ILV1 locus exhibits highly positioned nucleosomes whose organization is independent of known ILV1 regulation","1","80","11","YER086W","Interaction Data Present","Not A PMA1 Interactor"
"602","ILV2","855135","YMR108W","Acetolactate synthase; catalyses the first common step in isoleucine and valine biosynthesis and is the target of several classes of inhibitors, localizes to the mitochondria; expression of the gene is under general amino acid control","1","80","11","YMR108W","Interaction Data Present","Not A PMA1 Interactor"
"614","KAP95","851061","YLR347C","Karyopherin beta; forms a complex with Srp1p/Kap60p; interacts with nucleoporins to mediate nuclear import of NLS-containing cargo proteins via the nuclear pore complex; regulates PC biosynthesis; GDP-to-GTP exchange factor for Gsp1p","1","80","11","YLR347C","Interaction Data Present","Not A PMA1 Interactor"
"621","LCB1","855342","YMR296C","Component of serine palmitoyltransferase; responsible along with Lcb2p for the first committed step in sphingolipid synthesis, which is the condensation of serine with palmitoyl-CoA to form 3-ketosphinganine","1","80","11","YMR296C","Interaction Data Present","Not A PMA1 Interactor"
"642","LCB2","851634","YDR062W","Component of serine palmitoyltransferase; responsible along with Lcb1p for the first committed step in sphingolipid synthesis, which is the condensation of serine with palmitoyl-CoA to form 3-ketosphinganine","1","80","11","YDR062W","Interaction Data Present","Not A PMA1 Interactor"
"649","MCM6","852673","YGL201C","Protein involved in DNA replication; component of the Mcm2-7 hexameric helicase complex that binds chromatin as a part of the pre-replicative complex; forms a subcomplex with Mcm4p and Mcm7p","1","80","11","YGL201C","Interaction Data Present","Not A PMA1 Interactor"
"675","MDL1","850885","YLR188W","Mitochondrial inner membrane half-type ABC transporter; mediates export of peptides generated upon proteolysis of mitochondrial proteins; plays a role in the regulation of cellular resistance to oxidative stress","1","80","11","YLR188W","Interaction Data Present","Not A PMA1 Interactor"
"686","MDN1","850796","YLR106C","Huge dynein-related AAA-type ATPase (midasin); forms extended pre-60S particle with the Rix1 complex (Rix1p-Ipi1p-Ipi3p); acts in removal of ribosomal biogenesis factors at successive steps of pre-60S assembly and export from nucleus","1","80","11","YLR106C","Interaction Data Present","Not A PMA1 Interactor"
"701","MNN5","853253","YJL186W","Alpha-1,2-mannosyltransferase; responsible for addition of the second alpha-1,2-linked mannose of the branches on the mannan backbone of oligosaccharides, localizes to an early Golgi compartment","1","80","11","YJL186W","Interaction Data Present","Not A PMA1 Interactor"
"716","MON2","855420","YNL297C","Protein with a role in endocytosis and vacuole integrity; peripheral membrane protein; interacts with and negatively regulates Arl1p; localizes to the endosome; member of the Sec7p family of proteins","1","80","11","YNL297C","Interaction Data Present","Not A PMA1 Interactor"
"721","MSN5","851935","YDR335W","Karyopherin; involved in nuclear import and export of proteins, including import of replication protein A and export of Far1p and transcription factors Swi5p, Swi6p, Msn2p, and Pho4p; required for re-export of mature tRNAs after their retrograde import from the cytoplasm; exportin-5 homolog","1","80","11","YDR335W","Interaction Data Present","Not A PMA1 Interactor"
"748","NDI1","854919","YML120C","NADH:ubiquinone oxidoreductase; transfers electrons from NADH to ubiquinone in respiratory chain but does not pump protons, in contrast to higher eukaryotic multisubunit respiratory complex I; upon apoptotic stress, is activated in mitochondria by N-terminal cleavage, then translocates to cytoplasm to induce apoptosis; homolog of human AIFM2; yeast NDI1 complements several phenotypes of human cell line with mutated MT-ND4, implicated in Leber hereditary optic neuropathy","1","80","11","YML120C","Interaction Data Present","Not A PMA1 Interactor"
"758","NEW1","855875","YPL226W","ATP binding cassette protein; cosediments with polysomes and is required for biogenesis of the small ribosomal subunit; Asn/Gln-rich rich region supports [NU+] prion formation and susceptibility to [PSI+] prion induction","1","80","11","YPL226W","Interaction Data Present","Not A PMA1 Interactor"
"785","NPA3","853535","YJR072C","Member of the conserved GPN-loop GTPase family; has a role in transport of RNA polymerase II to the nucleus; exhibits GTP-dependent binding to PolII; has ATPase activity; involved in sister chromatid cohesion; phosphorylated by the Pcl1p-Pho85p kinase complex; human homolog XAB1 interacts with human RNA polymerase II; protein abundance increases in response to DNA replication stress","1","80","11","YJR072C","Interaction Data Present","Not A PMA1 Interactor"
"803","NUP133","853957","YKR082W","Subunit of Nup84p subcomplex of nuclear pore complex (NPC); contributes to nucleocytoplasmic transport, NPC biogenesis; is involved in establishment of a normal nucleocytoplasmic concentration gradient of GTPase Gsp1p; also plays roles in several processes that may require localization of genes or chromosomes at nuclear periphery, including double-strand break repair, transcription and chromatin silencing; relocalizes to cytosol in response to hypoxia; homolog of human NUP133","1","80","11","YKR082W","Interaction Data Present","Not A PMA1 Interactor"
"844","NUP188","854868","YML103C","Subunit of the inner ring of the nuclear pore complex (NPC); contributes to NPC organization and nucleocytoplasmic transport; homologous to human NUP188","1","80","11","YML103C","Interaction Data Present","Not A PMA1 Interactor"
"860","NUP192","853410","YJL039C","Essential subunit of inner ring of nuclear pore complex (NPC); plays a role in modulating transport through the NPC; homologous to human NUP205","1","80","11","YJL039C","No Interaction Data","Not A PMA1 Interactor"
"874","OLA1","852313","YBR025C","P-loop ATPase with similarity to human OLA1 and bacterial YchF; identified as specifically interacting with the proteasome; null mutant displays increased translation rate and increased readthrough of premature stop codons; protein abundance increases in response to hydrogen peroxide and to DNA replication stress","1","80","11","YBR025C","Interaction Data Present","Not A PMA1 Interactor"
"889","OLE1","852825","YGL055W","Delta(9) fatty acid desaturase; required for monounsaturated fatty acid synthesis and for normal distribution of mitochondria","1","80","11","YGL055W","Interaction Data Present","Not A PMA1 Interactor"
"902","PDR12","856049","YPL058C","Plasma membrane ATP-binding cassette (ABC) transporter; weak-acid-inducible multidrug transporter required for weak organic acid resistance; induced by sorbate and benzoate and regulated by War1p; mutants exhibit sorbate hypersensitivity","1","80","11","YPL058C","No Interaction Data","Not A PMA1 Interactor"
"912","PGK1","850370","YCR012W","3-phosphoglycerate kinase; catalyzes transfer of high-energy phosphoryl groups from the acyl phosphate of 1,3-bisphosphoglycerate to ADP to produce ATP; key enzyme in glycolysis and gluconeogenesis","1","80","11","YCR012W","Interaction Data Present","Not A PMA1 Interactor"
"930","PHO81","853148","YGR233C","Cyclin-dependent kinase (CDK) inhibitor; regulates Pho80p-Pho85p and Pcl7p-Pho85p cyclin-CDK complexes in response to phosphate levels; inhibitory activity for Pho80p-Pho85p requires myo-D-inositol heptakisphosphate (IP7) generated by Vip1p; relative distribution to the nucleus increases upon DNA replication stress","1","80","11","YGR233C","Interaction Data Present","Not A PMA1 Interactor"
"958","PHO91","855747","YNR013C","Low-affinity vacuolar phosphate transporter; exports phosphate from the vacuolar lumen to the cytosol; regulates phosphate and polyphosphate metabolism; acts upstream of Pho81p in regulation of the PHO pathway; localizes to sites of contact between the vacuole and mitochondria (vCLAMPs); deletion of pho84, pho87, pho89, pho90, and pho91 causes synthetic lethality; transcription independent of Pi and Pho4p activity; overexpression results in vigorous growth","1","80","11","YNR013C","Interaction Data Present","Not A PMA1 Interactor"
"968","PRO3","856744","YER023W","Delta 1-pyrroline-5-carboxylate reductase; catalyzes the last step in proline biosynthesis","1","80","11","YER023W","Interaction Data Present","Not A PMA1 Interactor"
"997","PRS1","853654","YKL181W","5-phospho-ribosyl-1(alpha)-pyrophosphate synthetase; synthesizes PRPP, which is required for nucleotide, histidine, and tryptophan biosynthesis; plays a key role in cell wall integrity (CWI) pathway; one of five related enzymes, which are active as heteromultimeric complexes; missense mutations in human homolog PRPS1 are associated with neuropathic Arts syndrome and Charcot-Marie Tooth (CMTX5) disease","1","80","11","YKL181W","Interaction Data Present","Not A PMA1 Interactor"
"1018","PRS5","854093","YOL061W","5-phospho-ribosyl-1(alpha)-pyrophosphate synthetase; synthesizes PRPP, which is required for nucleotide, histidine, and tryptophan biosynthesis; one of five related enzymes, which are active as heteromultimeric complexes; forms cytoplasmic foci upon DNA replication stress","1","80","11","YOL061W","Interaction Data Present","Not A PMA1 Interactor"
"1029","PSA1","851504","YDL055C","GDP-mannose pyrophosphorylase (mannose-1-phosphate guanyltransferase); synthesizes GDP-mannose from GTP and mannose-1-phosphate in cell wall biosynthesis; required for normal cell wall structure","1","80","11","YDL055C","Interaction Data Present","Not A PMA1 Interactor"
"1049","QRI1","851455","YDL103C","UDP-N-acetylglucosamine pyrophosphorylase; catalyzes the formation of UDP-N-acetylglucosamine (UDP-GlcNAc), which is important in cell wall biosynthesis, protein N-glycosylation, and GPI anchor biosynthesis; protein abundance increases in response to DNA replication stress","1","80","11","YDL103C","Interaction Data Present","Not A PMA1 Interactor"
"1058","RNA1","855275","YMR235C","GTPase activating protein (GAP) for Gsp1p; involved in nuclear transport","1","80","11","YMR235C","Interaction Data Present","Not A PMA1 Interactor"
"1072","RNR2","853427","YJL026W","Ribonucleotide-diphosphate reductase (RNR), small subunit; the RNR complex catalyzes the rate-limiting step in dNTP synthesis and is regulated by DNA replication and DNA damage checkpoint pathways via localization of the small subunits; RNR2 has a paralog, RNR4, that arose from the whole genome duplication","1","80","11","YJL026W","Interaction Data Present","Not A PMA1 Interactor"
"1089","RPB2","854322","YOR151C","RNA polymerase II second largest subunit B150; part of central core; similar to bacterial beta subunit","1","80","11","YOR151C","Interaction Data Present","Not A PMA1 Interactor"
"1100","RPG1","852371","YBR079C","eIF3a subunit of the eukaryotic translation initiation factor 3 (eIF3); subunit of the core complex of eIF3; essential for translation; part of a Prt1p-Rpg1p-Nip1p subcomplex that stimulates binding of mRNA and tRNA(i)Met to ribosomes; involved in translation reinitiation; eIF3 is also involved in programmed stop codon readthrough","1","80","11","YBR079C","Interaction Data Present","Not A PMA1 Interactor"
"1113","RPT5","854284","YOR117W","ATPase of the 19S regulatory particle of the 26S proteasome; one of six ATPases of the regulatory particle; involved in the degradation of ubiquitinated substrates; recruited to the GAL1-10 promoter region upon induction of transcription; similar to human TBP1","1","80","11","YOR117W","Interaction Data Present","Not A PMA1 Interactor"
"1125","RVB1","851771","YDR190C","ATP-dependent DNA helicase, also known as pontin; member of the AAA+ and RuvB-like protein families; similar to Rvb2p; conserved component of multiple complexes including the INO80 complex, the Swr1 complex, and the R2TP complex (Rvb1-Rvb2-Tah1-Pih1); involved in multiple processes such as chromatin remodeling, box C/D snoRNP assembly, and RNA polymerase II assembly","1","80","11","YDR190C","Interaction Data Present","Not A PMA1 Interactor"
"1137","SAC6","851707","YDR129C","Fimbrin, actin-bundling protein; cooperates with Scp1p in organization and maintenance of the actin cytoskeleton; phosphorylated by Cdc28p/Clb2p in metaphase on T103, to regulate conformation, and modulate actin filament binding affinity and actin cable dynamics; relocalizes from the plasma membrane to the cytoplasm upon DNA replication stress; human homologs PLS3 and LCP1 implicated in spinocerebellar ataxia type 2 (SCA2) can each complement yeast null mutant","1","80","11","YDR129C","Interaction Data Present","Not A PMA1 Interactor"
"1151","SEC17","852230","YBL050W","Alpha-SNAP cochaperone; SNARE-complex adaptor for Sec18 (NSF) during the disassembly of postfusion cis-SNARE complexes; stimulates the ATPase activity of Sec18p; peripheral membrane protein required for vesicular transport between ER and Golgi, the 'priming' step in homotypic vacuole fusion, and autophagy; similar to mammalian alpha-SNAP","1","80","11","YBL050W","No Interaction Data","Not A PMA1 Interactor"
"1161","SEC18","852372","YBR080C","AAA ATPase and SNARE disassembly chaperone; required for vesicular transport between ER and Golgi, the 'priming' step in homotypic vacuole fusion, autophagy, and protein secretion; releases Sec17p from SNAP complexes; has similarity to mammalian N-ethylmaleimide-sensitive factor (NSF)","1","80","11","YBR080C","Interaction Data Present","Not A PMA1 Interactor"
"1175","SEC23","856311","YPR181C","GTPase-activating protein, stimulates the GTPase activity of Sar1p; component of the Sec23p-Sec24p heterodimer of the COPII vesicle coat, involved in ER to Golgi transport; substrate of Ubp3/Bre5 complex; ubiquitylated by Ub-ligase Rsp5p; proteasome-mediated degradation of Sec23p is regulated by Cdc48p","1","80","11","YPR181C","Interaction Data Present","Not A PMA1 Interactor"
"1186","SEC61","851095","YLR378C","Conserved ER protein translocation channel; essential subunit of Sec61 complex (Sec61p, Sbh1p, and Sss1p); forms channel for SRP-dependent protein import; with Sec63 complex allows SRP-independent protein import into ER; involved in posttranslational soluble protein import into the ER, ERAD of soluble substrates, and misfolded soluble protein export from the ER","1","80","11","YLR378C","Interaction Data Present","Not A PMA1 Interactor"
"1204","SER1","854356","YOR184W","3-phosphoserine aminotransferase; catalyzes the formation of phosphoserine from 3-phosphohydroxypyruvate, required for serine and glycine biosynthesis; regulated by the general control of amino acid biosynthesis mediated by Gcn4p; protein abundance increases in response to DNA replication stress","1","80","11","YOR184W","Interaction Data Present","Not A PMA1 Interactor"
"1235","SEY1","854336","YOR165W","Dynamin-like GTPase that mediates homotypic ER fusion; has a role in ER morphology; interacts physically and genetically with Yop1p and Rtn1p; functional ortholog of the human atlastin ATL1, defects in which cause a form of the human disease hereditary spastic paraplegia; homolog of Arabidopsis RHD3","1","80","11","YOR165W","Interaction Data Present","Not A PMA1 Interactor"
"1278","SPF1","856681","YEL031W","P-type ATPase, ion transporter of the ER membrane; required to maintain normal lipid composition of intracellular compartments and proper targeting of mitochondrial outer membrane tail-anchored proteins; involved in ER function and Ca2+ homeostasis; required for regulating Hmg2p degradation; confers sensitivity to a killer toxin (SMKT) produced by Pichia farinosa KK1","1","80","11","YEL031W","Interaction Data Present","Not A PMA1 Interactor"
"1288","SSC1","853503","YJR045C","Hsp70 family ATPase; constituent of the import motor component of the Translocase of the Inner Mitochondrial membrane (TIM23 complex); involved in protein translocation and folding; subunit of SceI endonuclease; SSC1 has a paralog, ECM10, that arose from the whole genome duplication","1","80","11","YJR045C","Interaction Data Present","Not A PMA1 Interactor"
"1307","SSE1","855998","YPL106C","ATPase component of heat shock protein Hsp90 chaperone complex; serves as nucleotide exchange factor to load ATP onto the SSA class of cytosolic Hsp70s; plays a role in prion propagation and determining prion variants; binds unfolded proteins; member of Hsp110 subclass of HSP70 proteins; deletion results in spindle elongation in S phase; SSE1 has a paralog, SSE2, that arose from the whole genome duplication","1","80","11","YPL106C","Interaction Data Present","Not A PMA1 Interactor"
"1316","SSZ1","856461","YHR064C","Hsp70 protein that interacts with Zuo1p (a DnaJ homolog); interacts with Zuo1p to form a ribosome-associated complex that binds the ribosome via the Zuo1p subunit; also involved in pleiotropic drug resistance via sequential activation of PDR1 and PDR5; binds ATP","1","80","11","YHR064C","Interaction Data Present","Not A PMA1 Interactor"
"1323","SUI3","855838","YPL237W","Beta subunit of the translation initiation factor eIF2; involved in the identification of the start codon; proposed to be involved in mRNA binding","1","80","11","YPL237W","Interaction Data Present","Not A PMA1 Interactor"
"1337","TAT1","852361","YBR069C","Amino acid transporter for valine, leucine, isoleucine, and tyrosine; low-affinity tryptophan and histidine transporter; overexpression confers FK506 and FTY720 resistance; protein abundance increases in response to DNA replication stress","1","80","11","YBR069C","Interaction Data Present","Not A PMA1 Interactor"
"1344","TCB3","854903","YML072C","Cortical ER protein involved in ER-plasma membrane tethering; one of 6 proteins (Ist2p, Scs2p, Scs22p, Tcb1p, Tcb2p, Tcb3p) that connect ER to the plasma membrane (PM) and regulate PM phosphatidylinositol-4-phosphate (PI4P) levels by controlling access of Sac1p phosphatase to its substrate PI4P in the PM; localized to the bud via specific mRNA transport; non-tagged protein detected in a phosphorylated state in mitochondria; C-termini of Tcb1p, Tcb2p and Tcb3p interact","1","80","11","YML072C","Interaction Data Present","Not A PMA1 Interactor"
"1360","TCP1","851798","YDR212W","Alpha subunit of chaperonin-containing T-complex; complex mediates protein folding in the cytosol; involved in actin cytoskeleton maintenance; overexpression in neurons suppresses formation of pathogenic conformations of huntingtin protein","1","80","11","YDR212W","Interaction Data Present","Not A PMA1 Interactor"
"1407","TOM1","852068","YDR457W","E3 ubiquitin ligase of the hect-domain class; has a role in mRNA export from the nucleus and may regulate transcriptional coactivators; involved in degradation of excess histones; interacts with Dia2p and is required for Dia2p degradation; required to target Cdc6p for ubiquitin-mediated destruction during G1 phase","1","80","11","YDR457W","Interaction Data Present","Not A PMA1 Interactor"
"1419","TPO3","856279","YPR156C","Polyamine transporter of the major facilitator superfamily; member of the 12-spanner drug:H(+) antiporter DHA1 family; specific for spermine; localizes to the plasma membrane; TPO3 has a paralog, TPO2, that arose from the whole genome duplication","1","80","11","YPR156C","Interaction Data Present","Not A PMA1 Interactor"
"1452","TRM3","851446","YDL112W","2'-O-ribose methyltransferase; catalyzes the ribose methylation of the guanosine nucleotide at position 18 of tRNAs","1","80","11","YDL112W","Interaction Data Present","Not A PMA1 Interactor"
"1471","TRP5","852858","YGL026C","Tryptophan synthase; catalyzes the last step of tryptophan biosynthesis; regulated by the general control system of amino acid biosynthesis","1","80","11","YGL026C","Interaction Data Present","Not A PMA1 Interactor"
"1481","TUB1","854889","YML085C","Alpha-tubulin; associates with beta-tubulin (Tub2p) to form tubulin dimer, which polymerizes to form microtubules; relative distribution to nuclear foci increases upon DNA replication stress; TUB1 has a paralog, TUB3, that arose from the whole genome duplication","1","80","11","YML085C","Interaction Data Present","Not A PMA1 Interactor"
"1504","TUB2","850506","YFL037W","Beta-tubulin; associates with alpha-tubulin (Tub1p and Tub3p) to form tubulin dimer, which polymerizes to form microtubules; mutation in human ortholog is associated with congenital fibrosis of the extraocular muscles (CFEOM) with polymicrogyria","1","80","11","YFL037W","Interaction Data Present","Not A PMA1 Interactor"
"1529","UFD4","853859","YKL010C","Ubiquitin-protein ligase (E3); interacts with Rpt4p and Rpt6p, two subunits of the 19S particle of the 26S proteasome; cytoplasmic E3 involved in the degradation of ubiquitin fusion proteins; relative distribution to the nucleus increases upon DNA replication stress","1","80","11","YKL010C","Interaction Data Present","Not A PMA1 Interactor"
"1552","URA2","853311","YJL130C","Bifunctional carbamoylphosphate synthetase/aspartate transcarbamylase; catalyzes the first two enzymatic steps in the de novo biosynthesis of pyrimidines; both activities are subject to feedback inhibition by UTP","1","80","11","YJL130C","Interaction Data Present","Not A PMA1 Interactor"
"1561","URA7","852241","YBL039C","Major CTP synthase isozyme (see also URA8); catalyzes the ATP-dependent transfer of the amide nitrogen from glutamine to UTP, forming CTP, the final step in de novo biosynthesis of pyrimidines; involved in phospholipid biosynthesis; capable of forming cytoplasmic filaments termed cytoophidium, especially during conditions of glucose depletion; URA7 has a paralog, URA8, that arose from the whole genome duplication","1","80","11","YBL039C","No Interaction Data","Not A PMA1 Interactor"
"1576","VAC8","856702","YEL013W","Phosphorylated and palmitoylated vacuolar membrane protein; interacts with Atg13p, required for the cytoplasm-to-vacuole targeting (Cvt) pathway; interacts with Nvj1p to form nucleus-vacuole junctions","1","80","11","YEL013W","Interaction Data Present","Not A PMA1 Interactor"
