"","orf_name","band","GENENAME","DESCRIPTION","pep_cnts","crapome"
"85","YML120C","AFO05","NDI1","NADH:ubiquinone oxidoreductase; transfers electrons from NADH to ubiquinone in respiratory chain but does not pump protons, in contrast to higher eukaryotic multisubunit respiratory complex I; upon apoptotic stress, is activated in mitochondria by N-terminal cleavage, then translocates to cytoplasm to induce apoptosis; homolog of human AIFM2; yeast NDI1 complements several phenotypes of human cell line with mutated MT-ND4, implicated in Leber hereditary optic neuropathy",2,"Absent"
"86","YMR015C","AFO05","ERG5","C-22 sterol desaturase; a cytochrome P450 enzyme that catalyzes the formation of the C-22(23) double bond in the sterol side chain in ergosterol biosynthesis; may be a target of azole antifungal drugs",3,"Absent"
"87","YMR108W","AFO04","ILV2","Acetolactate synthase; catalyses the first common step in isoleucine and valine biosynthesis and is the target of several classes of inhibitors, localizes to the mitochondria; expression of the gene is under general amino acid control",2,"Present"
"88","YMR186W","AFO04","HSC82","Cytoplasmic chaperone of the Hsp90 family; plays a role in determining prion variants; redundant in function and nearly identical with Hsp82p, and together they are essential; expressed constitutively at 10-fold higher basal levels than HSP82 and induced 2-3 fold by heat shock; contains two acid-rich unstructured regions that promote the solubility of chaperone-substrate complexes; HSC82 has a paralog, HSP82, that arose from the whole genome duplication",6,"Present"
"89","YMR235C","AFO05","RNA1","GTPase activating protein (GAP) for Gsp1p; involved in nuclear transport",4,"Absent"
"90","YMR241W","AFO06","YHM2","Citrate and oxoglutarate carrier protein; exports citrate from and imports oxoglutarate into the mitochondrion, causing net export of NADPH reducing equivalents; also associates with mt nucleoids and has a role in replication and segregation of the mt genome",2,"Absent"
"91","YMR296C","AFO04","LCB1","Component of serine palmitoyltransferase; responsible along with Lcb2p for the first committed step in sphingolipid synthesis, which is the condensation of serine with palmitoyl-CoA to form 3-ketosphinganine",2,"Absent"
"92","YNL297C","AFO02","MON2","Protein with a role in endocytosis and vacuole integrity; peripheral membrane protein; interacts with and negatively regulates Arl1p; localizes to the endosome; member of the Sec7p family of proteins",4,"Absent"
"93","YNR013C","AFO04","PHO91","Low-affinity vacuolar phosphate transporter; exports phosphate from the vacuolar lumen to the cytosol; regulates phosphate and polyphosphate metabolism; acts upstream of Pho81p in regulation of the PHO pathway; localizes to sites of contact between the vacuole and mitochondria (vCLAMPs); deletion of pho84, pho87, pho89, pho90, and pho91 causes synthetic lethality; transcription independent of Pi and Pho4p activity; overexpression results in vigorous growth",3,"Absent"
"94","YNR038W","AFO04","DBP6","Essential protein involved in ribosome biogenesis; putative ATP-dependent RNA helicase of the DEAD-box protein family; human homolog DDX51 complements yeast dbp6 mutant",3,"Present"
"95","YOL061W","AFO05","PRS5","5-phospho-ribosyl-1(alpha)-pyrophosphate synthetase; synthesizes PRPP, which is required for nucleotide, histidine, and tryptophan biosynthesis; one of five related enzymes, which are active as heteromultimeric complexes; forms cytoplasmic foci upon DNA replication stress",3,"Absent"
"96","YOL097C","AFO05","WRS1","Cytoplasmic tryptophanyl-tRNA synthetase; aminoacylates tryptophanyl-tRNA; human homolog WARS can complement yeast null mutant",3,"Absent"
"97","YOR117W","AFO05","RPT5","ATPase of the 19S regulatory particle of the 26S proteasome; one of six ATPases of the regulatory particle; involved in the degradation of ubiquitinated substrates; recruited to the GAL1-10 promoter region upon induction of transcription; similar to human TBP1",3,"Present"
"98","YOR136W","AFO06","IDH2","Subunit of mitochondrial NAD(+)-dependent isocitrate dehydrogenase; complex catalyzes the oxidation of isocitrate to alpha-ketoglutarate in the TCA cycle; phosphorylated",2,"Absent"
"99","YOR151C","AFO03","RPB2","RNA polymerase II second largest subunit B150; part of central core; similar to bacterial beta subunit",2,"Absent"
"100","YOR165W","AFO04","SEY1","Dynamin-like GTPase that mediates homotypic ER fusion; has a role in ER morphology; interacts physically and genetically with Yop1p and Rtn1p; functional ortholog of the human atlastin ATL1, defects in which cause a form of the human disease hereditary spastic paraplegia; homolog of Arabidopsis RHD3",5,"Absent"
"101","YOR184W","AFO05","SER1","3-phosphoserine aminotransferase; catalyzes the formation of phosphoserine from 3-phosphohydroxypyruvate, required for serine and glycine biosynthesis; regulated by the general control of amino acid biosynthesis mediated by Gcn4p; protein abundance increases in response to DNA replication stress",2,"Absent"
"102","YOR260W","AFO04","GCD1","Gamma subunit of the translation initiation factor eIF2B; the guanine-nucleotide exchange factor for eIF2; activity subsequently regulated by phosphorylated eIF2; first identified as a negative regulator of GCN4 expression",2,"Absent"
"103","YPL058C","AFO03","PDR12","Plasma membrane ATP-binding cassette (ABC) transporter; weak-acid-inducible multidrug transporter required for weak organic acid resistance; induced by sorbate and benzoate and regulated by War1p; mutants exhibit sorbate hypersensitivity",3,"Absent"
"104","YPL106C","AFO04","SSE1","ATPase component of heat shock protein Hsp90 chaperone complex; serves as nucleotide exchange factor to load ATP onto the SSA class of cytosolic Hsp70s; plays a role in prion propagation and determining prion variants; binds unfolded proteins; member of Hsp110 subclass of HSP70 proteins; deletion results in spindle elongation in S phase; SSE1 has a paralog, SSE2, that arose from the whole genome duplication",2,"Present"
"105","YPL110C",NA,"GDE1","Glycerophosphocholine (GroPCho) phosphodiesterase; hydrolyzes GroPCho to choline and glycerolphosphate, for use as a phosphate source and as a precursor for phosphocholine synthesis; may interact with ribosomes",5,"Present"
"106","YPL160W","AFO03","CDC60","Cytosolic leucyl tRNA synthetase; ligates leucine to the appropriate tRNA; human homolog LARS can complement yeast temperature-sensitive mutant at restrictive temperature",2,"Absent"
"107","YPL226W","AFO03","NEW1","ATP binding cassette protein; cosediments with polysomes and is required for biogenesis of the small ribosomal subunit; Asn/Gln-rich rich region supports [NU+] prion formation and susceptibility to [PSI+] prion induction",4,"Present"
"108","YPL237W","AFO06","SUI3","Beta subunit of the translation initiation factor eIF2; involved in the identification of the start codon; proposed to be involved in mRNA binding",2,"Present"
"109","YPL249C","AFO03","GYP5","GTPase-activating protein (GAP) for yeast Rab family members; involved in ER to Golgi trafficking; exhibits GAP activity toward Ypt1p that is stimulated by Gyl1p, also acts on Sec4p; interacts with Gyl1p, Rvs161p and Rvs167p; involved in recruiting Rvs167p to the bud tip during polarized growth; relocalizes from bud neck to cytoplasm upon DNA replication stress; GYP5 has a paralog, GYL1, that arose from the whole genome duplication",2,"Absent"
"110","YPR058W","AFO06","YMC1","Secondary mitochondrial inner membrane glycine transporter; required with HEM25 for the transport of glycine into mitochondria for the initiation of heme biosynthesis; proposed role in oleate metabolism and glutamate biosynthesis; member of the mitochondrial carrier (MCF) family; localizes to the vacuole in response to H2O2; YMC1 has a paralog, YMC2, that arose from the whole genome duplication",2,"Absent"
"111","YPR156C","AFO05","TPO3","Polyamine transporter of the major facilitator superfamily; member of the 12-spanner drug:H(+) antiporter DHA1 family; specific for spermine; localizes to the plasma membrane; TPO3 has a paralog, TPO2, that arose from the whole genome duplication",3,"Absent"
"112","YPR181C","AFO04","SEC23","GTPase-activating protein, stimulates the GTPase activity of Sar1p; component of the Sec23p-Sec24p heterodimer of the COPII vesicle coat, involved in ER to Golgi transport; substrate of Ubp3/Bre5 complex; ubiquitylated by Ub-ligase Rsp5p; proteasome-mediated degradation of Sec23p is regulated by Cdc48p",2,"Absent"
