"","orf_name","band","GENENAME","DESCRIPTION","pep_cnts","crapome"
"1","YBL039C","AFO04","URA7","Major CTP synthase isozyme (see also URA8); catalyzes the ATP-dependent transfer of the amide nitrogen from glutamine to UTP, forming CTP, the final step in de novo biosynthesis of pyrimidines; involved in phospholipid biosynthesis; capable of forming cytoplasmic filaments termed cytoophidium, especially during conditions of glucose depletion; URA7 has a paralog, URA8, that arose from the whole genome duplication",4,"Present"
"2","YBL050W","AFO06","SEC17","Alpha-SNAP cochaperone; SNARE-complex adaptor for Sec18 (NSF) during the disassembly of postfusion cis-SNARE complexes; stimulates the ATPase activity of Sec18p; peripheral membrane protein required for vesicular transport between ER and Golgi, the 'priming' step in homotypic vacuole fusion, and autophagy; similar to mammalian alpha-SNAP",2,"Absent"
"3","YBR025C","AFO05","OLA1","P-loop ATPase with similarity to human OLA1 and bacterial YchF; identified as specifically interacting with the proteasome; null mutant displays increased translation rate and increased readthrough of premature stop codons; protein abundance increases in response to hydrogen peroxide and to DNA replication stress",2,"Absent"
"4","YBR031W","AFO06","RPL4A","Ribosomal 60S subunit protein L4A; N-terminally acetylated; homologous to mammalian ribosomal protein L4 and bacterial L4; RPL4A has a paralog, RPL4B, that arose from the whole genome duplication",2,"Present"
"5","YBR039W","AFO06","ATP3","Gamma subunit of the F1 sector of mitochondrial F1F0 ATP synthase; F1F0 ATP synthase is a large, evolutionarily conserved enzyme complex required for ATP synthesis",3,"Absent"
"6","YBR069C","AFO05","TAT1","Amino acid transporter for valine, leucine, isoleucine, and tyrosine; low-affinity tryptophan and histidine transporter; overexpression confers FK506 and FTY720 resistance; protein abundance increases in response to DNA replication stress",2,"Absent"
"7","YBR079C","AFO03","RPG1","eIF3a subunit of the eukaryotic translation initiation factor 3 (eIF3); subunit of the core complex of eIF3; essential for translation; part of a Prt1p-Rpg1p-Nip1p subcomplex that stimulates binding of mRNA and tRNA(i)Met to ribosomes; involved in translation reinitiation; eIF3 is also involved in programmed stop codon readthrough",2,"Present"
"8","YBR080C","AFO04","SEC18","AAA ATPase and SNARE disassembly chaperone; required for vesicular transport between ER and Golgi, the 'priming' step in homotypic vacuole fusion, autophagy, and protein secretion; releases Sec17p from SNAP complexes; has similarity to mammalian N-ethylmaleimide-sensitive factor (NSF)",2,"Absent"
"9","YBR127C","AFO05","VMA2","Subunit B of V1 peripheral membrane domain of vacuolar H+-ATPase; electrogenic proton pump found throughout the endomembrane system; contains nucleotide binding sites; also detected in the cytoplasm; protein abundance increases in response to DNA replication stress; human homolog ATP6V1B1, implicated in autosomal-recessive distal renal tubular acidosis (RTA) with sensorineural deafness, complements yeast null mutant",14,"Present"
"10","YBR287W","AFO06","YBR287W",NA,2,"Absent"
"11","YCR012W","AFO05","PGK1","3-phosphoglycerate kinase; catalyzes transfer of high-energy phosphoryl groups from the acyl phosphate of 1,3-bisphosphoglycerate to ADP to produce ATP; key enzyme in glycolysis and gluconeogenesis",2,"Present"
"12","YCR093W","AFO02","CDC39","Subunit of the CCR4-NOT1 core complex; this complex has multiple roles in the regulation of mRNA levels including regulation of transcription and destabilization of mRNA by deadenylation; basal transcription factor that increases initiation and elongation; activates the ATPase activity of Dhh1p, resulting in processing body disassembly",3,"Absent"
"13","YDL022W","AFO05","GPD1","NAD-dependent glycerol-3-phosphate dehydrogenase; key enzyme of glycerol synthesis, essential for growth under osmotic stress; expression regulated by high-osmolarity glycerol response pathway; protein abundance increases in response to DNA replication stress; constitutively inactivated via phosphorylation by the protein kinases Ypk1p and Ypk2p, dephosphorylation increases catalytic activity; forms a heterodimer with Pnc1p to facilitate its peroxisomal import",2,"Absent"
"14","YDL055C","AFO06","PSA1","GDP-mannose pyrophosphorylase (mannose-1-phosphate guanyltransferase); synthesizes GDP-mannose from GTP and mannose-1-phosphate in cell wall biosynthesis; required for normal cell wall structure",3,"Present"
"15","YDL100C","AFO06","GET3","Guanine nucleotide exchange factor for Gpa1p; amplifies G protein signaling; functions as a chaperone under ATP-depleted oxidative stress conditions; subunit of GET complex, involved in ATP dependent Golgi to ER trafficking and insertion of tail-anchored (TA) proteins into ER membrane under non-stress conditions; binds as dimer to transmembrane domain (TMD) cargo, shielding TMDs from aqueous solvent; protein abundance increases under DNA replication stress",5,"Absent"
"16","YDL103C","AFO05","QRI1","UDP-N-acetylglucosamine pyrophosphorylase; catalyzes the formation of UDP-N-acetylglucosamine (UDP-GlcNAc), which is important in cell wall biosynthesis, protein N-glycosylation, and GPI anchor biosynthesis; protein abundance increases in response to DNA replication stress",2,"Absent"
"17","YDL112W","AFO03","TRM3","2'-O-ribose methyltransferase; catalyzes the ribose methylation of the guanosine nucleotide at position 18 of tRNAs",6,"Absent"
"18","YDL185W","AFO04","VMA1","Subunit A of the V1 peripheral membrane domain of V-ATPase; protein precursor undergoes self-catalyzed splicing to yield the extein Tfp1p and the intein Vde (PI-SceI), which is a site-specific endonuclease; the V1 peripheral membrane domain of the vacuolar H+-ATPase (V-ATPase) has eight subunits; involved in methionine restriction extension of chronological lifespan in an autophagy-dependent manner",7,"Absent"
"19","YDR002W","AFO06","YRB1","Ran GTPase binding protein; involved in nuclear protein import and RNA export, ubiquitin-mediated protein degradation during the cell cycle; shuttles between the nucleus and cytoplasm; is essential; homolog of human RanBP1",2,"Absent"
"20","YDR062W","AFO05","LCB2","Component of serine palmitoyltransferase; responsible along with Lcb1p for the first committed step in sphingolipid synthesis, which is the condensation of serine with palmitoyl-CoA to form 3-ketosphinganine",3,"Absent"
"21","YDR099W",NA,"BMH2","14-3-3 protein, minor isoform; controls proteome at post-transcriptional level, binds proteins and DNA, involved in regulation of many processes including exocytosis, vesicle transport, Ras/MAPK signaling, and rapamycin-sensitive signaling; protein increases in abundance and relative distribution to the nucleus increases upon DNA replication stress; abundance relative to Bmh1p increases during sporulation",7,"Absent"
"22","YDR129C","AFO04","SAC6","Fimbrin, actin-bundling protein; cooperates with Scp1p in organization and maintenance of the actin cytoskeleton; phosphorylated by Cdc28p/Clb2p in metaphase on T103, to regulate conformation, and modulate actin filament binding affinity and actin cable dynamics; relocalizes from the plasma membrane to the cytoplasm upon DNA replication stress; human homologs PLS3 and LCP1 implicated in spinocerebellar ataxia type 2 (SCA2) can each complement yeast null mutant",2,"Absent"
"23","YDR141C","AFO02","DOP1","Golgi-localized, leucine-zipper domain containing protein; involved in endosome to Golgi transport, organization of the ER, establishing cell polarity, and morphogenesis; detected in highly purified mitochondria in high-throughput studies",2,"Absent"
"24","YDR188W","AFO04","CCT6","Subunit of the cytosolic chaperonin Cct ring complex; related to Tcp1p, essential protein that is required for the assembly of actin and tubulins in vivo; contains an ATP-binding motif",3,"Absent"
"25","YDR190C","AFO05","RVB1","ATP-dependent DNA helicase, also known as pontin; member of the AAA+ and RuvB-like protein families; similar to Rvb2p; conserved component of multiple complexes including the INO80 complex, the Swr1 complex, and the R2TP complex (Rvb1-Rvb2-Tah1-Pih1); involved in multiple processes such as chromatin remodeling, box C/D snoRNP assembly, and RNA polymerase II assembly",3,"Absent"
"26","YDR212W","AFO05","TCP1","Alpha subunit of chaperonin-containing T-complex; complex mediates protein folding in the cytosol; involved in actin cytoskeleton maintenance; overexpression in neurons suppresses formation of pathogenic conformations of huntingtin protein",5,"Absent"
"27","YDR335W","AFO03","MSN5","Karyopherin; involved in nuclear import and export of proteins, including import of replication protein A and export of Far1p and transcription factors Swi5p, Swi6p, Msn2p, and Pho4p; required for re-export of mature tRNAs after their retrograde import from the cytoplasm; exportin-5 homolog",4,"Absent"
"28","YDR457W","AFO01","TOM1","E3 ubiquitin ligase of the hect-domain class; has a role in mRNA export from the nucleus and may regulate transcriptional coactivators; involved in degradation of excess histones; interacts with Dia2p and is required for Dia2p degradation; required to target Cdc6p for ubiquitin-mediated destruction during G1 phase",13,"Absent"
"29","YDR508C","AFO05","GNP1","High-affinity glutamine permease; also transports Leu, Ser, Thr, Cys, Met and Asn; expression is fully dependent on Grr1p and modulated by the Ssy1p-Ptr3p-Ssy5p (SPS) sensor of extracellular amino acids; GNP1 has a paralog, AGP1, that arose from the whole genome duplication",3,"Absent"
"30","YEL013W","AFO05","VAC8","Phosphorylated and palmitoylated vacuolar membrane protein; interacts with Atg13p, required for the cytoplasm-to-vacuole targeting (Cvt) pathway; interacts with Nvj1p to form nucleus-vacuole junctions",4,"Absent"
"31","YEL022W","AFO02","GEA2","Guanine nucleotide exchange factor for ADP ribosylation factors (ARFs); involved in vesicular transport between the Golgi and ER, Golgi organization, and actin cytoskeleton organization; GEA2 has a paralog, GEA1, that arose from the whole genome duplication",5,"Absent"
"32","YEL031W",NA,"SPF1","P-type ATPase, ion transporter of the ER membrane; required to maintain normal lipid composition of intracellular compartments and proper targeting of mitochondrial outer membrane tail-anchored proteins; involved in ER function and Ca2+ homeostasis; required for regulating Hmg2p degradation; confers sensitivity to a killer toxin (SMKT) produced by Pichia farinosa KK1",7,"Absent"
"33","YER023W","AFO06","PRO3","Delta 1-pyrroline-5-carboxylate reductase; catalyzes the last step in proline biosynthesis",8,"Absent"
"34","YER086W","AFO05","ILV1","Threonine deaminase, catalyzes first step in isoleucine biosynthesis; expression is under general amino acid control; ILV1 locus exhibits highly positioned nucleosomes whose organization is independent of known ILV1 regulation",2,"Absent"
"35","YER145C","AFO06","FTR1","High affinity iron permease; involved in the transport of iron across the plasma membrane; forms complex with Fet3p; expression is regulated by iron; protein abundance increases in response to DNA replication stress",2,"Absent"
"36","YFL037W","AFO05","TUB2","Beta-tubulin; associates with alpha-tubulin (Tub1p and Tub3p) to form tubulin dimer, which polymerizes to form microtubules; mutation in human ortholog is associated with congenital fibrosis of the extraocular muscles (CFEOM) with polymicrogyria",10,"Present"
"37","YGL026C","AFO04","TRP5","Tryptophan synthase; catalyzes the last step of tryptophan biosynthesis; regulated by the general control system of amino acid biosynthesis",2,"Absent"
"38","YGL055W","AFO05","OLE1","Delta(9) fatty acid desaturase; required for monounsaturated fatty acid synthesis and for normal distribution of mitochondria",2,"Absent"
"39","YGL148W","AFO06","ARO2","Bifunctional chorismate synthase and flavin reductase; catalyzes the conversion of 5-enolpyruvylshikimate 3-phosphate (EPSP) to form chorismate, which is a precursor to aromatic amino acids; protein abundance increases in response to DNA replication stress",3,"Absent"
"40","YGL195W",NA,"GCN1","Positive regulator of the Gcn2p kinase activity; forms a complex with Gcn20p; proposed to stimulate Gcn2p activation by an uncharged tRNA",39,"Present"
"41","YGL201C",NA,"MCM6","Protein involved in DNA replication; component of the Mcm2-7 hexameric helicase complex that binds chromatin as a part of the pre-replicative complex; forms a subcomplex with Mcm4p and Mcm7p",4,"Absent"
"42","YGL206C","AFO02","CHC1","Clathrin heavy chain; subunit of the major coat protein involved in intracellular protein transport and endocytosis; the clathrin triskelion is a trimeric molecule composed of three heavy chains that radiate from a vertex and three light chains which bind noncovalently near the vertex of the triskelion; the light chain (CLC1) is thought to regulate function",12,"Absent"
"43","YGL234W","AFO04","ADE5,7","Enzyme of the 'de novo' purine nucleotide biosynthetic pathway; contains aminoimidazole ribotide synthetase and glycinamide ribotide synthetase activities",6,"Absent"
"44","YGR175C","AFO05","ERG1","Squalene epoxidase; catalyzes the epoxidation of squalene to 2,3-oxidosqualene; plays an essential role in the ergosterol-biosynthesis pathway and is the specific target of the antifungal drug terbinafine; human SQLE functionally complements the lethality of the erg1 null mutation",2,"Absent"
"45","YGR191W","AFO05","HIP1","High-affinity histidine permease; also involved in the transport of manganese ions",2,"Absent"
"46","YGR233C","AFO03","PHO81","Cyclin-dependent kinase (CDK) inhibitor; regulates Pho80p-Pho85p and Pcl7p-Pho85p cyclin-CDK complexes in response to phosphate levels; inhibitory activity for Pho80p-Pho85p requires myo-D-inositol heptakisphosphate (IP7) generated by Vip1p; relative distribution to the nucleus increases upon DNA replication stress",6,"Absent"
"47","YHR005C","AFO05","GPA1","Subunit of the G protein involved in pheromone response; GTP-binding alpha subunit of the heterotrimeric G protein; negatively regulates the mating pathway by sequestering G(beta)gamma and by triggering an adaptive response; activates Vps34p at the endosome; protein abundance increases in response to DNA replication stress",2,"Absent"
"48","YHR020W","AFO04","YHR020W",NA,4,"Absent"
"49","YHR064C","AFO04","SSZ1","Hsp70 protein that interacts with Zuo1p (a DnaJ homolog); interacts with Zuo1p to form a ribosome-associated complex that binds the ribosome via the Zuo1p subunit; also involved in pleiotropic drug resistance via sequential activation of PDR1 and PDR5; binds ATP",2,"Present"
"50","YHR108W","AFO04","GGA2","Protein that regulates Arf1p, Arf2p to facilitate Golgi trafficking; binds phosphatidylinositol 4-phosphate, which plays a role in TGN localization; has homology to gamma-adaptin; GGA2 has a paralog, GGA1, that arose from the whole genome duplication",2,"Absent"
"51","YHR174W","AFO05","ENO2","Enolase II, a phosphopyruvate hydratase; catalyzes conversion of 2-phosphoglycerate to phosphoenolpyruvate during glycolysis and the reverse reaction during gluconeogenesis; expression induced in response to glucose; ENO2 has a paralog, ENO1, that arose from the whole genome duplication",9,"Present"
"52","YHR190W","AFO05","ERG9","Farnesyl-diphosphate farnesyl transferase (squalene synthase); joins two farnesyl pyrophosphate moieties to form squalene in the sterol biosynthesis pathway",3,"Absent"
"53","YIL142W","AFO05","CCT2","Subunit beta of the cytosolic chaperonin Cct ring complex; related to Tcp1p, required for the assembly of actin and tubulins in vivo",3,"Absent"
"54","YJL012C","AFO04","VTC4","Vacuolar membrane polyphosphate polymerase; subunit of the vacuolar transporter chaperone (VTC) complex involved in synthesis and transfer of polyP to the vacuole; regulates membrane trafficking; role in non-autophagic vacuolar fusion; protein abundance increases in response to DNA replication stress",4,"Absent"
"55","YJL026W","AFO05","RNR2","Ribonucleotide-diphosphate reductase (RNR), small subunit; the RNR complex catalyzes the rate-limiting step in dNTP synthesis and is regulated by DNA replication and DNA damage checkpoint pathways via localization of the small subunits; RNR2 has a paralog, RNR4, that arose from the whole genome duplication",3,"Absent"
"56","YJL039C","AFO02","NUP192","Essential subunit of inner ring of nuclear pore complex (NPC); plays a role in modulating transport through the NPC; homologous to human NUP205",3,"Absent"
"57","YJL130C","AFO02","URA2","Bifunctional carbamoylphosphate synthetase/aspartate transcarbamylase; catalyzes the first two enzymatic steps in the de novo biosynthesis of pyrimidines; both activities are subject to feedback inhibition by UTP",16,"Present"
"58","YJL186W",NA,"MNN5","Alpha-1,2-mannosyltransferase; responsible for addition of the second alpha-1,2-linked mannose of the branches on the mannan backbone of oligosaccharides, localizes to an early Golgi compartment",3,"Absent"
"59","YJR045C","AFO04","SSC1","Hsp70 family ATPase; constituent of the import motor component of the Translocase of the Inner Mitochondrial membrane (TIM23 complex); involved in protein translocation and folding; subunit of SceI endonuclease; SSC1 has a paralog, ECM10, that arose from the whole genome duplication",6,"Present"
"60","YJR064W",NA,"CCT5","Subunit of the cytosolic chaperonin Cct ring complex; related to Tcp1p, required for the assembly of actin and tubulins in vivo",7,"Absent"
"61","YJR065C","AFO05","ARP3","Essential component of the Arp2/3 complex; Arp2/3 is a highly conserved actin nucleation center required for the motility and integrity of actin patches; involved in endocytosis and membrane growth and polarity",2,"Absent"
"62","YJR072C","AFO05","NPA3","Member of the conserved GPN-loop GTPase family; has a role in transport of RNA polymerase II to the nucleus; exhibits GTP-dependent binding to PolII; has ATPase activity; involved in sister chromatid cohesion; phosphorylated by the Pcl1p-Pho85p kinase complex; human homolog XAB1 interacts with human RNA polymerase II; protein abundance increases in response to DNA replication stress",5,"Absent"
"63","YJR109C","AFO03","CPA2","Large subunit of carbamoyl phosphate synthetase; carbamoyl phosphate synthetase catalyzes a step in the synthesis of citrulline, an arginine precursor",2,"Absent"
"64","YJR121W",NA,"ATP2","Beta subunit of the F1 sector of mitochondrial F1F0 ATP synthase; which is a large, evolutionarily conserved enzyme complex required for ATP synthesis; F1 translationally regulates ATP6 and ATP8 expression to achieve a balanced output of ATP synthase genes encoded in nucleus and mitochondria; phosphorylated",7,"Present"
"65","YKL010C","AFO02","UFD4","Ubiquitin-protein ligase (E3); interacts with Rpt4p and Rpt6p, two subunits of the 19S particle of the 26S proteasome; cytoplasmic E3 involved in the degradation of ubiquitin fusion proteins; relative distribution to the nucleus increases upon DNA replication stress",5,"Absent"
"66","YKL100C","AFO04","YKL100C",NA,2,"Absent"
"67","YKL126W","AFO04","YPK1","S/T protein kinase; phosphorylates, downregulates flippase activator Fpk1p; inactivates Orm1p and Orm2p by phosphorylation in response to compromised sphingolipid synthesis; involved in the TORC-dependent phosphorylation of ribosomal proteins Rps6a/b (S6); mutations affect receptor-mediated endocytosis and sphingolipid-mediated and cell integrity signaling pathways; human homolog SGK1 can complement a null mutant; human homolog SGK2 can complement a ypk1 ypk2 double mutant",2,"Absent"
"68","YKL181W","AFO05","PRS1","5-phospho-ribosyl-1(alpha)-pyrophosphate synthetase; synthesizes PRPP, which is required for nucleotide, histidine, and tryptophan biosynthesis; plays a key role in cell wall integrity (CWI) pathway; one of five related enzymes, which are active as heteromultimeric complexes; missense mutations in human homolog PRPS1 are associated with neuropathic Arts syndrome and Charcot-Marie Tooth (CMTX5) disease",3,"Absent"
"69","YKL182W","AFO02","FAS1","Beta subunit of fatty acid synthetase; complex catalyzes the synthesis of long-chain saturated fatty acids; contains acetyltransacylase, dehydratase, enoyl reductase, malonyl transacylase, and palmitoyl transacylase activities",3,"Present"
"70","YKR059W","AFO05","TIF1","Translation initiation factor eIF4A; DEA(D/H)-box RNA helicase that couples ATPase activity to RNA binding and unwinding; forms a dumbbell structure of two compact domains connected by a linker; interacts with eIF4G; protein abundance increases in response to DNA replication stress; TIF1 has a paralog, TIF2, that arose from the whole genome duplication",5,"Present"
"71","YKR082W","AFO03","NUP133","Subunit of Nup84p subcomplex of nuclear pore complex (NPC); contributes to nucleocytoplasmic transport, NPC biogenesis; is involved in establishment of a normal nucleocytoplasmic concentration gradient of GTPase Gsp1p; also plays roles in several processes that may require localization of genes or chromosomes at nuclear periphery, including double-strand break repair, transcription and chromatin silencing; relocalizes to cytosol in response to hypoxia; homolog of human NUP133",6,"Absent"
"72","YLR044C","AFO05","PDC1","Major of three pyruvate decarboxylase isozymes; key enzyme in alcoholic fermentation; decarboxylates pyruvate to acetaldehyde; involved in amino acid catabolism; subject to glucose-, ethanol-, and autoregulation; activated by phosphorylation in response to glucose levels; N-terminally propionylated in vivo",5,"Present"
"73","YLR056W","AFO06","ERG3","C-5 sterol desaturase; glycoprotein that catalyzes the introduction of a C-5(6) double bond into episterol, a precursor in ergosterol biosynthesis; transcriptionally down-regulated when ergosterol is in excess; mutants are viable, but cannot grow on non-fermentable carbon sources; substrate of HRD ubiquitin ligase; mutation is functionally complemented by human SC5D",2,"Absent"
"74","YLR106C","AFO01","MDN1","Huge dynein-related AAA-type ATPase (midasin); forms extended pre-60S particle with the Rix1 complex (Rix1p-Ipi1p-Ipi3p); acts in removal of ribosomal biogenesis factors at successive steps of pre-60S assembly and export from nucleus",3,"Absent"
"75","YLR153C","AFO04","ACS2","Acetyl-coA synthetase isoform; along with Acs1p, acetyl-coA synthetase isoform is the nuclear source of acetyl-coA for histone acetylation; mutants affect global transcription; required for growth on glucose; expressed under anaerobic conditions",3,"Absent"
"76","YLR188W","AFO04","MDL1","Mitochondrial inner membrane half-type ABC transporter; mediates export of peptides generated upon proteolysis of mitochondrial proteins; plays a role in the regulation of cellular resistance to oxidative stress",2,"Absent"
"77","YLR220W","AFO06","CCC1","Vacuolar Fe2+/Mn2+ transporter; suppresses respiratory deficit of yfh1 mutants, which lack the ortholog of mammalian frataxin, by preventing mitochondrial iron accumulation; relative distribution to the vacuole decreases upon DNA replication stress",2,"Absent"
"78","YLR342W","AFO02","FKS1","Catalytic subunit of 1,3-beta-D-glucan synthase; functionally redundant with alternate catalytic subunit Gsc2p; binds to regulatory subunit Rho1p; involved in cell wall synthesis and maintenance; localizes to sites of cell wall remodeling; FKS1 has a paralog, GSC2, that arose from the whole genome duplication",4,"Present"
"79","YLR347C","AFO04","KAP95","Karyopherin beta; forms a complex with Srp1p/Kap60p; interacts with nucleoporins to mediate nuclear import of NLS-containing cargo proteins via the nuclear pore complex; regulates PC biosynthesis; GDP-to-GTP exchange factor for Gsp1p",4,"Absent"
"80","YLR378C","AFO06","SEC61","Conserved ER protein translocation channel; essential subunit of Sec61 complex (Sec61p, Sbh1p, and Sss1p); forms channel for SRP-dependent protein import; with Sec63 complex allows SRP-independent protein import into ER; involved in posttranslational soluble protein import into the ER, ERAD of soluble substrates, and misfolded soluble protein export from the ER",2,"Absent"
"81","YLR447C","AFO06","VMA6","Subunit d of the V0 integral membrane domain of V-ATPase; part of the electrogenic proton pump found in the endomembrane system; required for V1 domain assembly on the vacuolar membrane; the V0 integral membrane domain of vacuolar H+-ATPase (V-ATPase) has five subunits",2,"Absent"
"82","YML072C","AFO02","TCB3","Cortical ER protein involved in ER-plasma membrane tethering; one of 6 proteins (Ist2p, Scs2p, Scs22p, Tcb1p, Tcb2p, Tcb3p) that connect ER to the plasma membrane (PM) and regulate PM phosphatidylinositol-4-phosphate (PI4P) levels by controlling access of Sac1p phosphatase to its substrate PI4P in the PM; localized to the bud via specific mRNA transport; non-tagged protein detected in a phosphorylated state in mitochondria; C-termini of Tcb1p, Tcb2p and Tcb3p interact",2,"Present"
"83","YML085C","AFO05","TUB1","Alpha-tubulin; associates with beta-tubulin (Tub2p) to form tubulin dimer, which polymerizes to form microtubules; relative distribution to nuclear foci increases upon DNA replication stress; TUB1 has a paralog, TUB3, that arose from the whole genome duplication",6,"Absent"
"84","YML103C","AFO02","NUP188","Subunit of the inner ring of the nuclear pore complex (NPC); contributes to NPC organization and nucleocytoplasmic transport; homologous to human NUP188",6,"Absent"
