"","GENENAME","ENTREZID","ENSEMBL","DESCRIPTION","min_peps","min_prob","min_crap_expt","orf_name","status","pma_int"
"1611","VMA2","852424","YBR127C","Subunit B of V1 peripheral membrane domain of vacuolar H+-ATPase; electrogenic proton pump found throughout the endomembrane system; contains nucleotide binding sites; also detected in the cytoplasm; protein abundance increases in response to DNA replication stress; human homolog ATP6V1B1, implicated in autosomal-recessive distal renal tubular acidosis (RTA) with sensorineural deafness, complements yeast null mutant","1","90","13","YBR127C","Interaction Data Present","Not A PMA1 Interactor"
"1631","VMA6","851168","YLR447C","Subunit d of the V0 integral membrane domain of V-ATPase; part of the electrogenic proton pump found in the endomembrane system; required for V1 domain assembly on the vacuolar membrane; the V0 integral membrane domain of vacuolar H+-ATPase (V-ATPase) has five subunits","1","90","13","YLR447C","Interaction Data Present","Not A PMA1 Interactor"
"1648","VTC4","853441","YJL012C","Vacuolar membrane polyphosphate polymerase; subunit of the vacuolar transporter chaperone (VTC) complex involved in synthesis and transfer of polyP to the vacuole; regulates membrane trafficking; role in non-autophagic vacuolar fusion; protein abundance increases in response to DNA replication stress","1","90","13","YJL012C","Interaction Data Present","Not A PMA1 Interactor"
"1662","WRS1","854056","YOL097C","Cytoplasmic tryptophanyl-tRNA synthetase; aminoacylates tryptophanyl-tRNA; human homolog WARS can complement yeast null mutant","1","90","13","YOL097C","No Interaction Data","Not A PMA1 Interactor"
"1670","YBR287W",NA,NA,NA,"1","90","13","YBR287W","Interaction Data Present","Not A PMA1 Interactor"
"1697","YHM2","855282","YMR241W","Citrate and oxoglutarate carrier protein; exports citrate from and imports oxoglutarate into the mitochondrion, causing net export of NADPH reducing equivalents; also associates with mt nucleoids and has a role in replication and segregation of the mt genome","1","90","13","YMR241W","Interaction Data Present","Not A PMA1 Interactor"
"1699","YHR020W",NA,NA,NA,"1","90","13","YHR020W","Interaction Data Present","Not A PMA1 Interactor"
"1712","YKL100C",NA,NA,NA,"1","90","13","YKL100C","Interaction Data Present","Not A PMA1 Interactor"
"1727","YMC1","856171","YPR058W","Secondary mitochondrial inner membrane glycine transporter; required with HEM25 for the transport of glycine into mitochondria for the initiation of heme biosynthesis; proposed role in oleate metabolism and glutamate biosynthesis; member of the mitochondrial carrier (MCF) family; localizes to the vacuole in response to H2O2; YMC1 has a paralog, YMC2, that arose from the whole genome duplication","1","90","13","YPR058W","Interaction Data Present","Not A PMA1 Interactor"
"1744","YPK1","853733","YKL126W","S/T protein kinase; phosphorylates, downregulates flippase activator Fpk1p; inactivates Orm1p and Orm2p by phosphorylation in response to compromised sphingolipid synthesis; involved in the TORC-dependent phosphorylation of ribosomal proteins Rps6a/b (S6); mutations affect receptor-mediated endocytosis and sphingolipid-mediated and cell integrity signaling pathways; human homolog SGK1 can complement a null mutant; human homolog SGK2 can complement a ypk1 ypk2 double mutant","1","90","13","YKL126W","Interaction Data Present","Not A PMA1 Interactor"
"1768","YRB1","851565","YDR002W","Ran GTPase binding protein; involved in nuclear protein import and RNA export, ubiquitin-mediated protein degradation during the cell cycle; shuttles between the nucleus and cytoplasm; is essential; homolog of human RanBP1","1","90","13","YDR002W","Interaction Data Present","Not A PMA1 Interactor"
"10","ACS2","850846","YLR153C","Acetyl-coA synthetase isoform; along with Acs1p, acetyl-coA synthetase isoform is the nuclear source of acetyl-coA for histone acetylation; mutants affect global transcription; required for growth on glucose; expressed under anaerobic conditions","1","90","15","YLR153C","Interaction Data Present","Not A PMA1 Interactor"
"18","ADE5,7","852617","YGL234W","Enzyme of the 'de novo' purine nucleotide biosynthetic pathway; contains aminoimidazole ribotide synthetase and glycinamide ribotide synthetase activities","1","90","15","YGL234W","Interaction Data Present","Not A PMA1 Interactor"
"46","ARO2","852729","YGL148W","Bifunctional chorismate synthase and flavin reductase; catalyzes the conversion of 5-enolpyruvylshikimate 3-phosphate (EPSP) to form chorismate, which is a precursor to aromatic amino acids; protein abundance increases in response to DNA replication stress","1","90","15","YGL148W","Interaction Data Present","Not A PMA1 Interactor"
"59","ARP3","853528","YJR065C","Essential component of the Arp2/3 complex; Arp2/3 is a highly conserved actin nucleation center required for the motility and integrity of actin patches; involved in endocytosis and membrane growth and polarity","1","90","15","YJR065C","Interaction Data Present","Not A PMA1 Interactor"
"84","ATP2","853585","YJR121W","Beta subunit of the F1 sector of mitochondrial F1F0 ATP synthase; which is a large, evolutionarily conserved enzyme complex required for ATP synthesis; F1 translationally regulates ATP6 and ATP8 expression to achieve a balanced output of ATP synthase genes encoded in nucleus and mitochondria; phosphorylated","1","90","15","YJR121W","Interaction Data Present","Not A PMA1 Interactor"
"93","ATP3","852327","YBR039W","Gamma subunit of the F1 sector of mitochondrial F1F0 ATP synthase; F1F0 ATP synthase is a large, evolutionarily conserved enzyme complex required for ATP synthesis","1","90","15","YBR039W","Interaction Data Present","Not A PMA1 Interactor"
"112","BMH2","851676","YDR099W","14-3-3 protein, minor isoform; controls proteome at post-transcriptional level, binds proteins and DNA, involved in regulation of many processes including exocytosis, vesicle transport, Ras/MAPK signaling, and rapamycin-sensitive signaling; protein increases in abundance and relative distribution to the nucleus increases upon DNA replication stress; abundance relative to Bmh1p increases during sporulation","1","90","15","YDR099W","Interaction Data Present","Not A PMA1 Interactor"
"135","CCC1","850917","YLR220W","Vacuolar Fe2+/Mn2+ transporter; suppresses respiratory deficit of yfh1 mutants, which lack the ortholog of mammalian frataxin, by preventing mitochondrial iron accumulation; relative distribution to the vacuole decreases upon DNA replication stress","1","90","15","YLR220W","Interaction Data Present","Not A PMA1 Interactor"
"143","CCT2","854664","YIL142W","Subunit beta of the cytosolic chaperonin Cct ring complex; related to Tcp1p, required for the assembly of actin and tubulins in vivo","1","90","15","YIL142W","Interaction Data Present","Not A PMA1 Interactor"
"154","CCT5","853527","YJR064W","Subunit of the cytosolic chaperonin Cct ring complex; related to Tcp1p, required for the assembly of actin and tubulins in vivo","1","90","15","YJR064W","Interaction Data Present","Not A PMA1 Interactor"
"167","CCT6","851768","YDR188W","Subunit of the cytosolic chaperonin Cct ring complex; related to Tcp1p, essential protein that is required for the assembly of actin and tubulins in vivo; contains an ATP-binding motif","1","90","15","YDR188W","Interaction Data Present","Not A PMA1 Interactor"
"190","CDC39","850455","YCR093W","Subunit of the CCR4-NOT1 core complex; this complex has multiple roles in the regulation of mRNA levels including regulation of transcription and destabilization of mRNA by deadenylation; basal transcription factor that increases initiation and elongation; activates the ATPase activity of Dhh1p, resulting in processing body disassembly","1","90","15","YCR093W","Interaction Data Present","Not A PMA1 Interactor"
"208","CDC60","855943","YPL160W","Cytosolic leucyl tRNA synthetase; ligates leucine to the appropriate tRNA; human homolog LARS can complement yeast temperature-sensitive mutant at restrictive temperature","1","90","15","YPL160W","Interaction Data Present","Not A PMA1 Interactor"
"210","CHC1","852666","YGL206C","Clathrin heavy chain; subunit of the major coat protein involved in intracellular protein transport and endocytosis; the clathrin triskelion is a trimeric molecule composed of three heavy chains that radiate from a vertex and three light chains which bind noncovalently near the vertex of the triskelion; the light chain (CLC1) is thought to regulate function","1","90","15","YGL206C","Interaction Data Present","Not A PMA1 Interactor"
"242","CPA2","853573","YJR109C","Large subunit of carbamoyl phosphate synthetase; carbamoyl phosphate synthetase catalyzes a step in the synthesis of citrulline, an arginine precursor","1","90","15","YJR109C","Interaction Data Present","Not A PMA1 Interactor"
"250","DBP6","855774","YNR038W","Essential protein involved in ribosome biogenesis; putative ATP-dependent RNA helicase of the DEAD-box protein family; human homolog DDX51 complements yeast dbp6 mutant","1","90","15","YNR038W","Interaction Data Present","Not A PMA1 Interactor"
"253","DOP1","851719","YDR141C","Golgi-localized, leucine-zipper domain containing protein; involved in endosome to Golgi transport, organization of the ER, establishing cell polarity, and morphogenesis; detected in highly purified mitochondria in high-throughput studies","1","90","15","YDR141C","Interaction Data Present","Not A PMA1 Interactor"
"270","ENO2","856579","YHR174W","Enolase II, a phosphopyruvate hydratase; catalyzes conversion of 2-phosphoglycerate to phosphoenolpyruvate during glycolysis and the reverse reaction during gluconeogenesis; expression induced in response to glucose; ENO2 has a paralog, ENO1, that arose from the whole genome duplication","1","90","15","YHR174W","Interaction Data Present","Not A PMA1 Interactor"
"275","ERG1","853086","YGR175C","Squalene epoxidase; catalyzes the epoxidation of squalene to 2,3-oxidosqualene; plays an essential role in the ergosterol-biosynthesis pathway and is the specific target of the antifungal drug terbinafine; human SQLE functionally complements the lethality of the erg1 null mutation","1","90","15","YGR175C","Interaction Data Present","Not A PMA1 Interactor"
"289","ERG3","850745","YLR056W","C-5 sterol desaturase; glycoprotein that catalyzes the introduction of a C-5(6) double bond into episterol, a precursor in ergosterol biosynthesis; transcriptionally down-regulated when ergosterol is in excess; mutants are viable, but cannot grow on non-fermentable carbon sources; substrate of HRD ubiquitin ligase; mutation is functionally complemented by human SC5D","1","90","15","YLR056W","Interaction Data Present","Not A PMA1 Interactor"
"315","ERG5","855029","YMR015C","C-22 sterol desaturase; a cytochrome P450 enzyme that catalyzes the formation of the C-22(23) double bond in the sterol side chain in ergosterol biosynthesis; may be a target of azole antifungal drugs","1","90","15","YMR015C","Interaction Data Present","Not A PMA1 Interactor"
"319","ERG9","856597","YHR190W","Farnesyl-diphosphate farnesyl transferase (squalene synthase); joins two farnesyl pyrophosphate moieties to form squalene in the sterol biosynthesis pathway","1","90","15","YHR190W","Interaction Data Present","Not A PMA1 Interactor"
"337","FAS1","853653","YKL182W","Beta subunit of fatty acid synthetase; complex catalyzes the synthesis of long-chain saturated fatty acids; contains acetyltransacylase, dehydratase, enoyl reductase, malonyl transacylase, and palmitoyl transacylase activities","1","90","15","YKL182W","Interaction Data Present","Not A PMA1 Interactor"
"349","FKS1","851055","YLR342W","Catalytic subunit of 1,3-beta-D-glucan synthase; functionally redundant with alternate catalytic subunit Gsc2p; binds to regulatory subunit Rho1p; involved in cell wall synthesis and maintenance; localizes to sites of cell wall remodeling; FKS1 has a paralog, GSC2, that arose from the whole genome duplication","1","90","15","YLR342W","Interaction Data Present","Not A PMA1 Interactor"
"352","FTR1","856888","YER145C","High affinity iron permease; involved in the transport of iron across the plasma membrane; forms complex with Fet3p; expression is regulated by iron; protein abundance increases in response to DNA replication stress","1","90","15","YER145C","Interaction Data Present","Not A PMA1 Interactor"
"380","GCD1","854434","YOR260W","Gamma subunit of the translation initiation factor eIF2B; the guanine-nucleotide exchange factor for eIF2; activity subsequently regulated by phosphorylated eIF2; first identified as a negative regulator of GCN4 expression","1","90","15","YOR260W","Interaction Data Present","Not A PMA1 Interactor"
"390","GCN1","852680","YGL195W","Positive regulator of the Gcn2p kinase activity; forms a complex with Gcn20p; proposed to stimulate Gcn2p activation by an uncharged tRNA","1","90","15","YGL195W","Interaction Data Present","Not A PMA1 Interactor"
"402","GDE1","855994","YPL110C","Glycerophosphocholine (GroPCho) phosphodiesterase; hydrolyzes GroPCho to choline and glycerolphosphate, for use as a phosphate source and as a precursor for phosphocholine synthesis; may interact with ribosomes","1","90","15","YPL110C","Interaction Data Present","Not A PMA1 Interactor"
"435","GEA2","856691","YEL022W","Guanine nucleotide exchange factor for ADP ribosylation factors (ARFs); involved in vesicular transport between the Golgi and ER, Golgi organization, and actin cytoskeleton organization; GEA2 has a paralog, GEA1, that arose from the whole genome duplication","1","90","15","YEL022W","Interaction Data Present","Not A PMA1 Interactor"
"442","GET3","851458","YDL100C","Guanine nucleotide exchange factor for Gpa1p; amplifies G protein signaling; functions as a chaperone under ATP-depleted oxidative stress conditions; subunit of GET complex, involved in ATP dependent Golgi to ER trafficking and insertion of tail-anchored (TA) proteins into ER membrane under non-stress conditions; binds as dimer to transmembrane domain (TMD) cargo, shielding TMDs from aqueous solvent; protein abundance increases under DNA replication stress","1","90","15","YDL100C","Interaction Data Present","Not A PMA1 Interactor"
"478","GGA2","856508","YHR108W","Protein that regulates Arf1p, Arf2p to facilitate Golgi trafficking; binds phosphatidylinositol 4-phosphate, which plays a role in TGN localization; has homology to gamma-adaptin; GGA2 has a paralog, GGA1, that arose from the whole genome duplication","1","90","15","YHR108W","Interaction Data Present","Not A PMA1 Interactor"
"484","GNP1","852121","YDR508C","High-affinity glutamine permease; also transports Leu, Ser, Thr, Cys, Met and Asn; expression is fully dependent on Grr1p and modulated by the Ssy1p-Ptr3p-Ssy5p (SPS) sensor of extracellular amino acids; GNP1 has a paralog, AGP1, that arose from the whole genome duplication","1","90","15","YDR508C","Interaction Data Present","Not A PMA1 Interactor"
"499","GPA1","856394","YHR005C","Subunit of the G protein involved in pheromone response; GTP-binding alpha subunit of the heterotrimeric G protein; negatively regulates the mating pathway by sequestering G(beta)gamma and by triggering an adaptive response; activates Vps34p at the endosome; protein abundance increases in response to DNA replication stress","1","90","15","YHR005C","Interaction Data Present","Not A PMA1 Interactor"
"512","GPD1","851539","YDL022W","NAD-dependent glycerol-3-phosphate dehydrogenase; key enzyme of glycerol synthesis, essential for growth under osmotic stress; expression regulated by high-osmolarity glycerol response pathway; protein abundance increases in response to DNA replication stress; constitutively inactivated via phosphorylation by the protein kinases Ypk1p and Ypk2p, dephosphorylation increases catalytic activity; forms a heterodimer with Pnc1p to facilitate its peroxisomal import","1","90","15","YDL022W","Interaction Data Present","Not A PMA1 Interactor"
"539","GYP5","855827","YPL249C","GTPase-activating protein (GAP) for yeast Rab family members; involved in ER to Golgi trafficking; exhibits GAP activity toward Ypt1p that is stimulated by Gyl1p, also acts on Sec4p; interacts with Gyl1p, Rvs161p and Rvs167p; involved in recruiting Rvs167p to the bud tip during polarized growth; relocalizes from bud neck to cytoplasm upon DNA replication stress; GYP5 has a paralog, GYL1, that arose from the whole genome duplication","1","90","15","YPL249C","Interaction Data Present","Not A PMA1 Interactor"
"544","HIP1","853104","YGR191W","High-affinity histidine permease; also involved in the transport of manganese ions","1","90","15","YGR191W","Interaction Data Present","PMA1 Interactor"
"560","HSC82","855224","YMR186W","Cytoplasmic chaperone of the Hsp90 family; plays a role in determining prion variants; redundant in function and nearly identical with Hsp82p, and together they are essential; expressed constitutively at 10-fold higher basal levels than HSP82 and induced 2-3 fold by heat shock; contains two acid-rich unstructured regions that promote the solubility of chaperone-substrate complexes; HSC82 has a paralog, HSP82, that arose from the whole genome duplication","1","90","15","YMR186W","Interaction Data Present","Not A PMA1 Interactor"
"571","IDH2","854303","YOR136W","Subunit of mitochondrial NAD(+)-dependent isocitrate dehydrogenase; complex catalyzes the oxidation of isocitrate to alpha-ketoglutarate in the TCA cycle; phosphorylated","1","90","15","YOR136W","Interaction Data Present","Not A PMA1 Interactor"
"588","ILV1","856819","YER086W","Threonine deaminase, catalyzes first step in isoleucine biosynthesis; expression is under general amino acid control; ILV1 locus exhibits highly positioned nucleosomes whose organization is independent of known ILV1 regulation","1","90","15","YER086W","Interaction Data Present","Not A PMA1 Interactor"
"594","ILV2","855135","YMR108W","Acetolactate synthase; catalyses the first common step in isoleucine and valine biosynthesis and is the target of several classes of inhibitors, localizes to the mitochondria; expression of the gene is under general amino acid control","1","90","15","YMR108W","Interaction Data Present","Not A PMA1 Interactor"
"610","KAP95","851061","YLR347C","Karyopherin beta; forms a complex with Srp1p/Kap60p; interacts with nucleoporins to mediate nuclear import of NLS-containing cargo proteins via the nuclear pore complex; regulates PC biosynthesis; GDP-to-GTP exchange factor for Gsp1p","1","90","15","YLR347C","Interaction Data Present","Not A PMA1 Interactor"
"624","LCB1","855342","YMR296C","Component of serine palmitoyltransferase; responsible along with Lcb2p for the first committed step in sphingolipid synthesis, which is the condensation of serine with palmitoyl-CoA to form 3-ketosphinganine","1","90","15","YMR296C","Interaction Data Present","Not A PMA1 Interactor"
"645","LCB2","851634","YDR062W","Component of serine palmitoyltransferase; responsible along with Lcb1p for the first committed step in sphingolipid synthesis, which is the condensation of serine with palmitoyl-CoA to form 3-ketosphinganine","1","90","15","YDR062W","Interaction Data Present","Not A PMA1 Interactor"
"648","MCM6","852673","YGL201C","Protein involved in DNA replication; component of the Mcm2-7 hexameric helicase complex that binds chromatin as a part of the pre-replicative complex; forms a subcomplex with Mcm4p and Mcm7p","1","90","15","YGL201C","Interaction Data Present","Not A PMA1 Interactor"
"676","MDL1","850885","YLR188W","Mitochondrial inner membrane half-type ABC transporter; mediates export of peptides generated upon proteolysis of mitochondrial proteins; plays a role in the regulation of cellular resistance to oxidative stress","1","90","15","YLR188W","Interaction Data Present","Not A PMA1 Interactor"
"678","MDN1","850796","YLR106C","Huge dynein-related AAA-type ATPase (midasin); forms extended pre-60S particle with the Rix1 complex (Rix1p-Ipi1p-Ipi3p); acts in removal of ribosomal biogenesis factors at successive steps of pre-60S assembly and export from nucleus","1","90","15","YLR106C","Interaction Data Present","Not A PMA1 Interactor"
"692","MNN5","853253","YJL186W","Alpha-1,2-mannosyltransferase; responsible for addition of the second alpha-1,2-linked mannose of the branches on the mannan backbone of oligosaccharides, localizes to an early Golgi compartment","1","90","15","YJL186W","Interaction Data Present","Not A PMA1 Interactor"
"714","MON2","855420","YNL297C","Protein with a role in endocytosis and vacuole integrity; peripheral membrane protein; interacts with and negatively regulates Arl1p; localizes to the endosome; member of the Sec7p family of proteins","1","90","15","YNL297C","Interaction Data Present","Not A PMA1 Interactor"
"734","MSN5","851935","YDR335W","Karyopherin; involved in nuclear import and export of proteins, including import of replication protein A and export of Far1p and transcription factors Swi5p, Swi6p, Msn2p, and Pho4p; required for re-export of mature tRNAs after their retrograde import from the cytoplasm; exportin-5 homolog","1","90","15","YDR335W","Interaction Data Present","Not A PMA1 Interactor"
"737","NDI1","854919","YML120C","NADH:ubiquinone oxidoreductase; transfers electrons from NADH to ubiquinone in respiratory chain but does not pump protons, in contrast to higher eukaryotic multisubunit respiratory complex I; upon apoptotic stress, is activated in mitochondria by N-terminal cleavage, then translocates to cytoplasm to induce apoptosis; homolog of human AIFM2; yeast NDI1 complements several phenotypes of human cell line with mutated MT-ND4, implicated in Leber hereditary optic neuropathy","1","90","15","YML120C","Interaction Data Present","Not A PMA1 Interactor"
"754","NEW1","855875","YPL226W","ATP binding cassette protein; cosediments with polysomes and is required for biogenesis of the small ribosomal subunit; Asn/Gln-rich rich region supports [NU+] prion formation and susceptibility to [PSI+] prion induction","1","90","15","YPL226W","Interaction Data Present","Not A PMA1 Interactor"
"771","NPA3","853535","YJR072C","Member of the conserved GPN-loop GTPase family; has a role in transport of RNA polymerase II to the nucleus; exhibits GTP-dependent binding to PolII; has ATPase activity; involved in sister chromatid cohesion; phosphorylated by the Pcl1p-Pho85p kinase complex; human homolog XAB1 interacts with human RNA polymerase II; protein abundance increases in response to DNA replication stress","1","90","15","YJR072C","Interaction Data Present","Not A PMA1 Interactor"
"789","NUP133","853957","YKR082W","Subunit of Nup84p subcomplex of nuclear pore complex (NPC); contributes to nucleocytoplasmic transport, NPC biogenesis; is involved in establishment of a normal nucleocytoplasmic concentration gradient of GTPase Gsp1p; also plays roles in several processes that may require localization of genes or chromosomes at nuclear periphery, including double-strand break repair, transcription and chromatin silencing; relocalizes to cytosol in response to hypoxia; homolog of human NUP133","1","90","15","YKR082W","Interaction Data Present","Not A PMA1 Interactor"
"819","NUP188","854868","YML103C","Subunit of the inner ring of the nuclear pore complex (NPC); contributes to NPC organization and nucleocytoplasmic transport; homologous to human NUP188","1","90","15","YML103C","Interaction Data Present","Not A PMA1 Interactor"
"859","NUP192","853410","YJL039C","Essential subunit of inner ring of nuclear pore complex (NPC); plays a role in modulating transport through the NPC; homologous to human NUP205","1","90","15","YJL039C","No Interaction Data","Not A PMA1 Interactor"
"864","OLA1","852313","YBR025C","P-loop ATPase with similarity to human OLA1 and bacterial YchF; identified as specifically interacting with the proteasome; null mutant displays increased translation rate and increased readthrough of premature stop codons; protein abundance increases in response to hydrogen peroxide and to DNA replication stress","1","90","15","YBR025C","Interaction Data Present","Not A PMA1 Interactor"
"890","OLE1","852825","YGL055W","Delta(9) fatty acid desaturase; required for monounsaturated fatty acid synthesis and for normal distribution of mitochondria","1","90","15","YGL055W","Interaction Data Present","Not A PMA1 Interactor"
"892","PDC1","850733","YLR044C","Major of three pyruvate decarboxylase isozymes; key enzyme in alcoholic fermentation; decarboxylates pyruvate to acetaldehyde; involved in amino acid catabolism; subject to glucose-, ethanol-, and autoregulation; activated by phosphorylation in response to glucose levels; N-terminally propionylated in vivo","1","90","15","YLR044C","Interaction Data Present","Not A PMA1 Interactor"
"901","PDR12","856049","YPL058C","Plasma membrane ATP-binding cassette (ABC) transporter; weak-acid-inducible multidrug transporter required for weak organic acid resistance; induced by sorbate and benzoate and regulated by War1p; mutants exhibit sorbate hypersensitivity","1","90","15","YPL058C","No Interaction Data","Not A PMA1 Interactor"
"917","PGK1","850370","YCR012W","3-phosphoglycerate kinase; catalyzes transfer of high-energy phosphoryl groups from the acyl phosphate of 1,3-bisphosphoglycerate to ADP to produce ATP; key enzyme in glycolysis and gluconeogenesis","1","90","15","YCR012W","Interaction Data Present","Not A PMA1 Interactor"
"931","PHO81","853148","YGR233C","Cyclin-dependent kinase (CDK) inhibitor; regulates Pho80p-Pho85p and Pcl7p-Pho85p cyclin-CDK complexes in response to phosphate levels; inhibitory activity for Pho80p-Pho85p requires myo-D-inositol heptakisphosphate (IP7) generated by Vip1p; relative distribution to the nucleus increases upon DNA replication stress","1","90","15","YGR233C","Interaction Data Present","Not A PMA1 Interactor"
